{
  "schemaVersion": "operations-snapshot/1",
  "generatedAt": "2026-10-27T05:01:01.898Z",
  "nodes": [
    {
      "nodeId": "admin-service",
      "displayName": "Admin service",
      "lifecycleStage": "setup-needed",
      "health": "setup-needed",
      "reason": "Owner setup is required before live operational evidence can exist.",
      "lastValidAt": null,
      "nextExpectedAt": null,
      "sloSatisfied": null,
      "failureCount": 0,
      "recoveryRefs": [],
      "ownerAttentionRefs": [],
      "costUsd": null,
      "artifactsReused": 0,
      "staleRecords": 0,
      "malformedRecords": 0,
      "evidenceRefs": []
    },
    {
      "nodeId": "boardlessai-umbrella",
      "displayName": "BoardlessAI umbrella",
      "lifecycleStage": "planned",
      "health": "held",
      "reason": "The node is not yet scheduled for live operation.",
      "lastValidAt": null,
      "nextExpectedAt": null,
      "sloSatisfied": null,
      "failureCount": 0,
      "recoveryRefs": [],
      "ownerAttentionRefs": [],
      "costUsd": null,
      "artifactsReused": 0,
      "staleRecords": 0,
      "malformedRecords": 0,
      "evidenceRefs": []
    },
    {
      "nodeId": "booksofhistory",
      "displayName": "BOOKSOFHISTORY",
      "lifecycleStage": "operating",
      "health": "unavailable",
      "reason": "No valid live or recovery receipt is available.",
      "lastValidAt": null,
      "nextExpectedAt": null,
      "sloSatisfied": null,
      "failureCount": 0,
      "recoveryRefs": [],
      "ownerAttentionRefs": [],
      "costUsd": null,
      "artifactsReused": 0,
      "staleRecords": 0,
      "malformedRecords": 0,
      "evidenceRefs": []
    },
    {
      "nodeId": "budget-service",
      "displayName": "Budget service",
      "lifecycleStage": "operating",
      "health": "unavailable",
      "reason": "No valid live or recovery receipt is available.",
      "lastValidAt": null,
      "nextExpectedAt": null,
      "sloSatisfied": null,
      "failureCount": 0,
      "recoveryRefs": [],
      "ownerAttentionRefs": [],
      "costUsd": null,
      "artifactsReused": 0,
      "staleRecords": 0,
      "malformedRecords": 0,
      "evidenceRefs": []
    },
    {
      "nodeId": "carousel-studio",
      "displayName": "Design Lab renderer",
      "lifecycleStage": "operating",
      "health": "unavailable",
      "reason": "No valid live or recovery receipt is available.",
      "lastValidAt": null,
      "nextExpectedAt": null,
      "sloSatisfied": null,
      "failureCount": 0,
      "recoveryRefs": [],
      "ownerAttentionRefs": [],
      "costUsd": null,
      "artifactsReused": 0,
      "staleRecords": 0,
      "malformedRecords": 0,
      "evidenceRefs": []
    },
    {
      "nodeId": "caught-up",
      "displayName": "Caught Up",
      "lifecycleStage": "operating",
      "health": "unavailable",
      "reason": "No valid live or recovery receipt is available.",
      "lastValidAt": null,
      "nextExpectedAt": null,
      "sloSatisfied": null,
      "failureCount": 0,
      "recoveryRefs": [],
      "ownerAttentionRefs": [],
      "costUsd": null,
      "artifactsReused": 0,
      "staleRecords": 0,
      "malformedRecords": 0,
      "evidenceRefs": []
    },
    {
      "nodeId": "contest-radar",
      "displayName": "Contest Radar",
      "lifecycleStage": "planned",
      "health": "held",
      "reason": "The node is not yet scheduled for live operation.",
      "lastValidAt": null,
      "nextExpectedAt": null,
      "sloSatisfied": null,
      "failureCount": 0,
      "recoveryRefs": [],
      "ownerAttentionRefs": [],
      "costUsd": null,
      "artifactsReused": 0,
      "staleRecords": 0,
      "malformedRecords": 0,
      "evidenceRefs": []
    },
    {
      "nodeId": "design-lab",
      "displayName": "Design Lab service",
      "lifecycleStage": "operating",
      "health": "unavailable",
      "reason": "No valid live or recovery receipt is available.",
      "lastValidAt": null,
      "nextExpectedAt": null,
      "sloSatisfied": null,
      "failureCount": 0,
      "recoveryRefs": [],
      "ownerAttentionRefs": [],
      "costUsd": null,
      "artifactsReused": 0,
      "staleRecords": 0,
      "malformedRecords": 0,
      "evidenceRefs": []
    },
    {
      "nodeId": "devshark",
      "displayName": "devShark",
      "lifecycleStage": "planned",
      "health": "held",
      "reason": "The node is not yet scheduled for live operation.",
      "lastValidAt": null,
      "nextExpectedAt": null,
      "sloSatisfied": null,
      "failureCount": 0,
      "recoveryRefs": [],
      "ownerAttentionRefs": [],
      "costUsd": null,
      "artifactsReused": 0,
      "staleRecords": 0,
      "malformedRecords": 0,
      "evidenceRefs": []
    },
    {
      "nodeId": "door-money",
      "displayName": "Door Money",
      "lifecycleStage": "operating",
      "health": "unavailable",
      "reason": "No valid live or recovery receipt is available.",
      "lastValidAt": null,
      "nextExpectedAt": null,
      "sloSatisfied": null,
      "failureCount": 0,
      "recoveryRefs": [],
      "ownerAttentionRefs": [],
      "costUsd": null,
      "artifactsReused": 0,
      "staleRecords": 0,
      "malformedRecords": 0,
      "evidenceRefs": [
        "state/operations/health/design-lab/current.json",
        "state/operations/health/social-distribution/current.json"
      ]
    },
    {
      "nodeId": "fightaiq",
      "displayName": "FightAIQ",
      "lifecycleStage": "operating",
      "health": "unavailable",
      "reason": "No valid live or recovery receipt is available.",
      "lastValidAt": null,
      "nextExpectedAt": null,
      "sloSatisfied": null,
      "failureCount": 0,
      "recoveryRefs": [],
      "ownerAttentionRefs": [],
      "costUsd": null,
      "artifactsReused": 0,
      "staleRecords": 0,
      "malformedRecords": 0,
      "evidenceRefs": []
    },
    {
      "nodeId": "goviral",
      "displayName": "GoVIRAL",
      "lifecycleStage": "operating",
      "health": "unavailable",
      "reason": "No valid live or recovery receipt is available.",
      "lastValidAt": null,
      "nextExpectedAt": null,
      "sloSatisfied": null,
      "failureCount": 0,
      "recoveryRefs": [],
      "ownerAttentionRefs": [],
      "costUsd": null,
      "artifactsReused": 0,
      "staleRecords": 0,
      "malformedRecords": 0,
      "evidenceRefs": []
    },
    {
      "nodeId": "health-service",
      "displayName": "Health service",
      "lifecycleStage": "operating",
      "health": "unavailable",
      "reason": "No valid live or recovery receipt is available.",
      "lastValidAt": null,
      "nextExpectedAt": null,
      "sloSatisfied": null,
      "failureCount": 0,
      "recoveryRefs": [],
      "ownerAttentionRefs": [],
      "costUsd": null,
      "artifactsReused": 0,
      "staleRecords": 0,
      "malformedRecords": 0,
      "evidenceRefs": []
    },
    {
      "nodeId": "implementation-plans",
      "displayName": "Implementation Plans",
      "lifecycleStage": "planned",
      "health": "held",
      "reason": "The node is not yet scheduled for live operation.",
      "lastValidAt": null,
      "nextExpectedAt": null,
      "sloSatisfied": null,
      "failureCount": 0,
      "recoveryRefs": [],
      "ownerAttentionRefs": [],
      "costUsd": null,
      "artifactsReused": 0,
      "staleRecords": 0,
      "malformedRecords": 0,
      "evidenceRefs": []
    },
    {
      "nodeId": "kvorum",
      "displayName": "Kvórum",
      "lifecycleStage": "operating",
      "health": "unavailable",
      "reason": "No valid live or recovery receipt is available.",
      "lastValidAt": null,
      "nextExpectedAt": null,
      "sloSatisfied": null,
      "failureCount": 0,
      "recoveryRefs": [],
      "ownerAttentionRefs": [],
      "costUsd": null,
      "artifactsReused": 0,
      "staleRecords": 0,
      "malformedRecords": 0,
      "evidenceRefs": [
        "state/operations/health/design-lab/current.json"
      ]
    },
    {
      "nodeId": "marketingshark",
      "displayName": "marketingShark",
      "lifecycleStage": "operating",
      "health": "unavailable",
      "reason": "No valid live or recovery receipt is available.",
      "lastValidAt": null,
      "nextExpectedAt": null,
      "sloSatisfied": null,
      "failureCount": 0,
      "recoveryRefs": [],
      "ownerAttentionRefs": [],
      "costUsd": null,
      "artifactsReused": 0,
      "staleRecords": 0,
      "malformedRecords": 0,
      "evidenceRefs": [
        "state/operations/health/carousel-studio/current.json"
      ]
    },
    {
      "nodeId": "metrics-service",
      "displayName": "Metrics service",
      "lifecycleStage": "operating",
      "health": "unavailable",
      "reason": "No valid live or recovery receipt is available.",
      "lastValidAt": null,
      "nextExpectedAt": null,
      "sloSatisfied": null,
      "failureCount": 0,
      "recoveryRefs": [],
      "ownerAttentionRefs": [],
      "costUsd": null,
      "artifactsReused": 0,
      "staleRecords": 0,
      "malformedRecords": 0,
      "evidenceRefs": []
    },
    {
      "nodeId": "mma-files",
      "displayName": "MMA Files",
      "lifecycleStage": "operating",
      "health": "unavailable",
      "reason": "No valid live or recovery receipt is available.",
      "lastValidAt": null,
      "nextExpectedAt": null,
      "sloSatisfied": null,
      "failureCount": 0,
      "recoveryRefs": [],
      "ownerAttentionRefs": [],
      "costUsd": null,
      "artifactsReused": 0,
      "staleRecords": 0,
      "malformedRecords": 0,
      "evidenceRefs": [
        "state/operations/health/fightaiq/current.json"
      ]
    },
    {
      "nodeId": "own-dashboard",
      "displayName": "OwnDashboard source bridge",
      "lifecycleStage": "setup-needed",
      "health": "setup-needed",
      "reason": "Owner setup is required before live operational evidence can exist.",
      "lastValidAt": null,